{
  "$schema": "https://json-schema.org/draft/2020-12/schema",
  "$id": "https://kanvibe.local/qa/scenario.schema.json",
  "title": "KanVibe QA Scenario",
  "type": "object",
  "required": [
    "id",
    "title",
    "seed",
    "coverage",
    "steps",
    "assertions",
    "artifacts"
  ],
  "properties": {
    "id": {
      "type": "string",
      "pattern": "^S(0[1-9]|1[0-4])-[a-z0-9-]+$"
    },
    "title": {
      "type": "string"
    },
    "seed": {
      "type": "string"
    },
    "coverage": {
      "type": "array",
      "items": {
        "type": "string"
      }
    },
    "steps": {
      "type": "array",
      "items": {
        "type": "object"
      }
    },
    "assertions": {
      "type": "array",
      "items": {
        "type": "object"
      }
    },
    "artifacts": {
      "type": "object",
      "required": [
        "screens",
        "videos"
      ],
      "properties": {
        "screens": {
          "type": "array",
          "items": {
            "type": "string"
          }
        },
        "videos": {
          "type": "array",
          "items": {
            "type": "string"
          }
        }
      }
    }
  }
}
