{
  "$schema": "./scenario.schema.json",
  "seed": "qa/seed/kanvibe-seed.sqlite",
  "id": "S10-settings-pane-layout",
  "title": "Settings and pane layout persistence round-trip",
  "coverage": [
    "settings",
    "app-settings",
    "pane-layout",
    "theme",
    "language"
  ],
  "steps": [
    {
      "action": "launchApp",
      "seed": "qa/seed/kanvibe-seed.sqlite",
      "locale": "ko",
      "theme": "dark",
      "viewport": {
        "width": 1440,
        "height": 960
      }
    },
    {
      "action": "waitForBoardReady"
    },
    {
      "action": "openSettings"
    },
    {
      "action": "setAppSetting",
      "key": "vim_mode_enabled",
      "value": "false"
    },
    {
      "action": "openPaneLayoutRoute",
      "projectId": "qa-project-kanvibe"
    },
    {
      "action": "selectPaneLayout",
      "layoutType": "vertical_2"
    },
    {
      "action": "captureScreen",
      "name": "settings-pane-layout"
    }
  ],
  "assertions": [
    {
      "type": "dbRow",
      "table": "app_settings",
      "where": {
        "key": "vim_mode_enabled"
      },
      "expected": {
        "value": "false"
      }
    },
    {
      "type": "dbRow",
      "table": "pane_layout_configs",
      "where": {
        "project_id": "qa-project-kanvibe"
      },
      "expected": {
        "layout_type": "vertical_2"
      }
    },
    {
      "type": "route",
      "pattern": "/pane-layout"
    }
  ],
  "artifacts": {
    "screens": [
      "screens/S10-settings-pane-layout.png"
    ],
    "videos": [
      "videos/S10-settings-pane-layout.mp4"
    ]
  }
}
