{
  "$schema": "./scenario.schema.json",
  "seed": "qa/seed/kanvibe-seed.sqlite",
  "id": "S12-project-filter-and-done-pagination",
  "title": "Project filter narrows board and Done column count remains accurate",
  "coverage": [
    "project-filter",
    "done-column",
    "load-more-done",
    "project-colors"
  ],
  "steps": [
    {
      "action": "launchApp",
      "seed": "qa/seed/kanvibe-seed.sqlite",
      "locale": "ko",
      "theme": "dark",
      "viewport": {
        "width": 1440,
        "height": 960
      }
    },
    {
      "action": "waitForBoardReady"
    },
    {
      "action": "openProjectFilter"
    },
    {
      "action": "selectProjects",
      "projectIds": [
        "qa-project-api"
      ]
    },
    {
      "action": "captureScreen",
      "name": "project-filter-api"
    }
  ],
  "assertions": [
    {
      "type": "onlyProjectTasksVisible",
      "projectId": "qa-project-api"
    },
    {
      "type": "taskVisible",
      "taskId": "qa-task-done-remote",
      "status": "done"
    },
    {
      "type": "taskNotVisible",
      "taskId": "qa-task-todo-local"
    }
  ],
  "artifacts": {
    "screens": [
      "screens/S12-project-filter-api.png"
    ],
    "videos": [
      "videos/S12-project-filter-and-done-pagination.mp4"
    ]
  }
}
